06:25:45.234261 IP 192.168.99.100.7051 > vp1.57476: Flags [P.], seq 2184784721:2184784766, ack 929890598, win 243, options [nop,nop,TS val 94014 ecr 93530], length 45
06:25:45.234272 IP vp1.57476 > 192.168.99.100.7051: Flags [.], ack 45, win 254, options [nop,nop,TS val 94014 ecr 94014], length 0
06:25:45.234497 IP vp1.57476 > 192.168.99.100.7051: Flags [P.], seq 1:110, ack 45, win 254, options [nop,nop,TS val 94014 ecr 94014], length 109
06:25:45.276075 IP 192.168.99.100.7051 > vp1.57476: Flags [.], ack 110, win 243, options [nop,nop,TS val 94019 ecr 94014], length 0
06:25:45.326850 IP vp1.52963 > 10.0.2.3.domain: 18296+ PTR? 100.99.168.192.in-addr.arpa. (45)
06:25:45.337849 IP 10.0.2.3.domain > vp1.52963: 18296 NXDomain 0/1/0 (94)
06:25:45.343102 IP vp1.57476 > 192.168.99.100.7051: Flags [P.], seq 110:155, ack 45, win 254, options [nop,nop,TS val 94025 ecr 94019], length 45
06:25:45.343123 IP 192.168.99.100.7051 > vp1.57476: Flags [.], ack 155, win 243, options [nop,nop,TS val 94025 ecr 94025], length 0
06:25:45.343854 IP 192.168.99.100.7051 > vp1.57476: Flags [P.], seq 45:154, ack 155, win 243, options [nop,nop,TS val 94025 ecr 94025], length 109
06:25:45.386375 IP vp1.57476 > 192.168.99.100.7051: Flags [.], ack 154, win 254, options [nop,nop,TS val 94030 ecr 94025], length 0
06:25:46.366171 IP vp1.43033 > 10.0.2.3.domain: 11978+ PTR? 3.2.0.10.in-addr.arpa. (39)
06:25:46.405450 IP 10.0.2.3.domain > vp1.43033: 11978 NXDomain* 0/1/0 (116)
06:25:50.234343 IP 192.168.99.100.7051 > vp1.57476: Flags [P.], seq 154:199, ack 155, win 243, options [nop,nop,TS val 94514 ecr 94030], length 45
06:25:50.234354 IP vp1.57476 > 192.168.99.100.7051: Flags [.], ack 199, win 254, options [nop,nop,TS val 94514 ecr 94514], length 0
06:25:50.234592 IP vp1.57476 > 192.168.99.100.7051: Flags [P.], seq 155:264, ack 199, win 254, options [nop,nop,TS val 94514 ecr 94514], length 109
06:25:50.276068 IP 192.168.99.100.7051 > vp1.57476: Flags [.], ack 264, win 243, options [nop,nop,TS val 94519 ecr 94514], length 0
06:25:50.342642 IP vp1.57476 > 192.168.99.100.7051: Flags [P.], seq 264:309, ack 199, win 254, options [nop,nop,TS val 94525 ecr 94519], length 45
06:25:50.342669 IP 192.168.99.100.7051 > vp1.57476: Flags [.], ack 309, win 243, options [nop,nop,TS val 94525 ecr 94525], length 0
06:25:50.343084 IP 192.168.99.100.7051 > vp1.57476: Flags [P.], seq 199:308, ack 309, win 243, options [nop,nop,TS val 94525 ecr 94525], length 109
06:25:50.386038 IP vp1.57476 > 192.168.99.100.7051: Flags [.], ack 308, win 254, options [nop,nop,TS val 94530 ecr 94525], length 0
06:25:55.234488 IP 192.168.99.100.7051 > vp1.57476: Flags [P.], seq 308:353, ack 309, win 243, options [nop,nop,TS val 95014 ecr 94530], length 45
06:25:55.234499 IP vp1.57476 > 192.168.99.100.7051: Flags [.], ack 353, win 254, options [nop,nop,TS val 95014 ecr 95014], length 0
06:25:55.234725 IP vp1.57476 > 192.168.99.100.7051: Flags [P.], seq 309:418, ack 353, win 254, options [nop,nop,TS val 95014 ecr 95014], length 109
06:25:55.276076 IP 192.168.99.100.7051 > vp1.57476: Flags [.], ack 418, win 243, options [nop,nop,TS val 95019 ecr 95014], length 0
06:25:55.343336 IP vp1.57476 > 192.168.99.100.7051: Flags [P.], seq 418:463, ack 353, win 254, options [nop,nop,TS val 95025 ecr 95019], length 45
06:25:55.343370 IP 192.168.99.100.7051 > vp1.57476: Flags [.], ack 463, win 243, options [nop,nop,TS val 95025 ecr 95025], length 0
06:25:55.343783 IP 192.168.99.100.7051 > vp1.57476: Flags [P.], seq 353:462, ack 463, win 243, options [nop,nop,TS val 95025 ecr 95025], length 109
06:25:55.386043 IP vp1.57476 > 192.168.99.100.7051: Flags [.], ack 462, win 254, options [nop,nop,TS val 95030 ecr 95025], length 0
06:26:00.234618 IP 192.168.99.100.7051 > vp1.57476: Flags [P.], seq 462:507, ack 463, win 243, options [nop,nop,TS val 95514 ecr 95030], length 45
06:26:00.234629 IP vp1.57476 > 192.168.99.100.7051: Flags [.], ack 507, win 254, options [nop,nop,TS val 95514 ecr 95514], length 0
06:26:00.234867 IP vp1.57476 > 192.168.99.100.7051: Flags [P.], seq 463:572, ack 507, win 254, options [nop,nop,TS val 95514 ecr 95514], length 109
06:26:00.276344 IP 192.168.99.100.7051 > vp1.57476: Flags [.], ack 572, win 243, options [nop,nop,TS val 95519 ecr 95514], length 0
06:26:00.342582 IP vp1.57476 > 192.168.99.100.7051: Flags [P.], seq 572:617, ack 507, win 254, options [nop,nop,TS val 95525 ecr 95519], length 45
06:26:00.342604 IP 192.168.99.100.7051 > vp1.57476: Flags [.], ack 617, win 243, options [nop,nop,TS val 95525 ecr 95525], length 0
06:26:00.342995 IP 192.168.99.100.7051 > vp1.57476: Flags [P.], seq 507:616, ack 617, win 243, options [nop,nop,TS val 95525 ecr 95525], length 109
06:26:00.396042 IP vp1.57476 > 192.168.99.100.7051: Flags [.], ack 616, win 254, options [nop,nop,TS val 95531 ecr 95525], length 0
06:26:05.234718 IP 192.168.99.100.7051 > vp1.57476: Flags [P.], seq 616:661, ack 617, win 243, options [nop,nop,TS val 96014 ecr 95531], length 45
06:26:05.234728 IP vp1.57476 > 192.168.99.100.7051: Flags [.], ack 661, win 254, options [nop,nop,TS val 96014 ecr 96014], length 0
06:26:05.234951 IP vp1.57476 > 192.168.99.100.7051: Flags [P.], seq 617:726, ack 661, win 254, options [nop,nop,TS val 96014 ecr 96014], length 109
06:26:05.276078 IP 192.168.99.100.7051 > vp1.57476: Flags [.], ack 726, win 243, options [nop,nop,TS val 96019 ecr 96014], length 0
06:26:05.343005 IP vp1.57476 > 192.168.99.100.7051: Flags [P.], seq 726:771, ack 661, win 254, options [nop,nop,TS val 96025 ecr 96019], length 45
06:26:05.343035 IP 192.168.99.100.7051 > vp1.57476: Flags [.], ack 771, win 243, options [nop,nop,TS val 96025 ecr 96025], length 0
06:26:05.343475 IP 192.168.99.100.7051 > vp1.57476: Flags [P.], seq 661:770, ack 771, win 243, options [nop,nop,TS val 96025 ecr 96025], length 109
06:26:05.386950 IP vp1.57476 > 192.168.99.100.7051: Flags [.], ack 770, win 254, options [nop,nop,TS val 96030 ecr 96025], length 0
06:26:10.234486 IP 192.168.99.100.7051 > vp1.57476: Flags [P.], seq 770:815, ack 771, win 243, options [nop,nop,TS val 96514 ecr 96030], length 45
06:26:10.234497 IP vp1.57476 > 192.168.99.100.7051: Flags [.], ack 815, win 254, options [nop,nop,TS val 96514 ecr 96514], length 0
06:26:10.234665 IP vp1.57476 > 192.168.99.100.7051: Flags [P.], seq 771:880, ack 815, win 254, options [nop,nop,TS val 96514 ecr 96514], length 109
06:26:10.276593 IP 192.168.99.100.7051 > vp1.57476: Flags [.], ack 880, win 243, options [nop,nop,TS val 96519 ecr 96514], length 0
06:26:10.342700 IP vp1.57476 > 192.168.99.100.7051: Flags [P.], seq 880:925, ack 815, win 254, options [nop,nop,TS val 96525 ecr 96519], length 45
06:26:10.342730 IP 192.168.99.100.7051 > vp1.57476: Flags [.], ack 925, win 243, options [nop,nop,TS val 96525 ecr 96525], length 0
06:26:10.343191 IP 192.168.99.100.7051 > vp1.57476: Flags [P.], seq 815:924, ack 925, win 243, options [nop,nop,TS val 96525 ecr 96525], length 109
06:26:10.386984 IP vp1.57476 > 192.168.99.100.7051: Flags [.], ack 924, win 254, options [nop,nop,TS val 96530 ecr 96525], length 0
06:26:15.234476 IP 192.168.99.100.7051 > vp1.57476: Flags [P.], seq 924:969, ack 925, win 243, options [nop,nop,TS val 97014 ecr 96530], length 45
06:26:15.234486 IP vp1.57476 > 192.168.99.100.7051: Flags [.], ack 969, win 254, options [nop,nop,TS val 97014 ecr 97014], length 0
06:26:15.234710 IP vp1.57476 > 192.168.99.100.7051: Flags [P.], seq 925:1034, ack 969, win 254, options [nop,nop,TS val 97014 ecr 97014], length 109
06:26:15.276770 IP 192.168.99.100.7051 > vp1.57476: Flags [.], ack 1034, win 243, options [nop,nop,TS val 97019 ecr 97014], length 0
06:26:15.342637 IP vp1.57476 > 192.168.99.100.7051: Flags [P.], seq 1034:1079, ack 969, win 254, options [nop,nop,TS val 97025 ecr 97019], length 45
06:26:15.342666 IP 192.168.99.100.7051 > vp1.57476: Flags [.], ack 1079, win 243, options [nop,nop,TS val 97025 ecr 97025], length 0
06:26:15.343088 IP 192.168.99.100.7051 > vp1.57476: Flags [P.], seq 969:1078, ack 1079, win 243, options [nop,nop,TS val 97025 ecr 97025], length 109
06:26:15.386049 IP vp1.57476 > 192.168.99.100.7051: Flags [.], ack 1078, win 254, options [nop,nop,TS val 97030 ecr 97025], length 0
06:26:20.234276 IP 192.168.99.100.7051 > vp1.57476: Flags [P.], seq 1078:1123, ack 1079, win 243, options [nop,nop,TS val 97514 ecr 97030], length 45
06:26:20.234286 IP vp1.57476 > 192.168.99.100.7051: Flags [.], ack 1123, win 254, options [nop,nop,TS val 97514 ecr 97514], length 0
06:26:20.234449 IP vp1.57476 > 192.168.99.100.7051: Flags [P.], seq 1079:1188, ack 1123, win 254, options [nop,nop,TS val 97514 ecr 97514], length 109
06:26:20.276882 IP 192.168.99.100.7051 > vp1.57476: Flags [.], ack 1188, win 243, options [nop,nop,TS val 97519 ecr 97514], length 0
06:26:20.342972 IP vp1.57476 > 192.168.99.100.7051: Flags [P.], seq 1188:1233, ack 1123, win 254, options [nop,nop,TS val 97525 ecr 97519], length 45
06:26:20.343001 IP 192.168.99.100.7051 > vp1.57476: Flags [.], ack 1233, win 243, options [nop,nop,TS val 97525 ecr 97525], length 0
06:26:20.343429 IP 192.168.99.100.7051 > vp1.57476: Flags [P.], seq 1123:1232, ack 1233, win 243, options [nop,nop,TS val 97525 ecr 97525], length 109
06:26:20.386770 IP vp1.57476 > 192.168.99.100.7051: Flags [.], ack 1232, win 254, options [nop,nop,TS val 97530 ecr 97525], length 0
06:26:25.234748 IP 192.168.99.100.7051 > vp1.57476: Flags [P.], seq 1232:1277, ack 1233, win 243, options [nop,nop,TS val 98014 ecr 97530], length 45
06:26:25.234758 IP vp1.57476 > 192.168.99.100.7051: Flags [.], ack 1277, win 254, options [nop,nop,TS val 98014 ecr 98014], length 0
06:26:25.234978 IP vp1.57476 > 192.168.99.100.7051: Flags [P.], seq 1233:1342, ack 1277, win 254, options [nop,nop,TS val 98014 ecr 98014], length 109
06:26:25.276498 IP 192.168.99.100.7051 > vp1.57476: Flags [.], ack 1342, win 243, options [nop,nop,TS val 98019 ecr 98014], length 0
06:26:25.342649 IP vp1.57476 > 192.168.99.100.7051: Flags [P.], seq 1342:1387, ack 1277, win 254, options [nop,nop,TS val 98025 ecr 98019], length 45
06:26:25.342677 IP 192.168.99.100.7051 > vp1.57476: Flags [.], ack 1387, win 243, options [nop,nop,TS val 98025 ecr 98025], length 0
06:26:25.343089 IP 192.168.99.100.7051 > vp1.57476: Flags [P.], seq 1277:1386, ack 1387, win 243, options [nop,nop,TS val 98025 ecr 98025], length 109
06:26:25.386882 IP vp1.57476 > 192.168.99.100.7051: Flags [.], ack 1386, win 254, options [nop,nop,TS val 98030 ecr 98025], length 0
06:26:30.234278 IP 192.168.99.100.7051 > vp1.57476: Flags [P.], seq 1386:1431, ack 1387, win 243, options [nop,nop,TS val 98514 ecr 98030], length 45
06:26:30.234288 IP vp1.57476 > 192.168.99.100.7051: Flags [.], ack 1431, win 254, options [nop,nop,TS val 98514 ecr 98514], length 0
06:26:30.234539 IP vp1.57476 > 192.168.99.100.7051: Flags [P.], seq 1387:1496, ack 1431, win 254, options [nop,nop,TS val 98514 ecr 98514], length 109
06:26:30.276490 IP 192.168.99.100.7051 > vp1.57476: Flags [.], ack 1496, win 243, options [nop,nop,TS val 98519 ecr 98514], length 0
06:26:30.342769 IP vp1.57476 > 192.168.99.100.7051: Flags [P.], seq 1496:1541, ack 1431, win 254, options [nop,nop,TS val 98525 ecr 98519], length 45
06:26:30.342800 IP 192.168.99.100.7051 > vp1.57476: Flags [.], ack 1541, win 243, options [nop,nop,TS val 98525 ecr 98525], length 0
06:26:30.343223 IP 192.168.99.100.7051 > vp1.57476: Flags [P.], seq 1431:1540, ack 1541, win 243, options [nop,nop,TS val 98525 ecr 98525], length 109
06:26:30.386071 IP vp1.57476 > 192.168.99.100.7051: Flags [.], ack 1540, win 254, options [nop,nop,TS val 98530 ecr 98525], length 0
06:26:35.236707 IP 192.168.99.100.7051 > vp1.57476: Flags [P.], seq 1540:1585, ack 1541, win 243, options [nop,nop,TS val 99015 ecr 98530], length 45
06:26:35.236723 IP vp1.57476 > 192.168.99.100.7051: Flags [.], ack 1585, win 254, options [nop,nop,TS val 99015 ecr 99015], length 0
06:26:35.237323 IP vp1.57476 > 192.168.99.100.7051: Flags [P.], seq 1541:1650, ack 1585, win 254, options [nop,nop,TS val 99015 ecr 99015], length 109
06:26:35.286236 IP 192.168.99.100.7051 > vp1.57476: Flags [.], ack 1650, win 243, options [nop,nop,TS val 99020 ecr 99015], length 0
06:26:35.342659 IP vp1.57476 > 192.168.99.100.7051: Flags [P.], seq 1650:1695, ack 1585, win 254, options [nop,nop,TS val 99025 ecr 99020], length 45
06:26:35.342686 IP 192.168.99.100.7051 > vp1.57476: Flags [.], ack 1695, win 243, options [nop,nop,TS val 99025 ecr 99025], length 0
06:26:35.345449 IP 192.168.99.100.7051 > vp1.57476: Flags [P.], seq 1585:1694, ack 1695, win 243, options [nop,nop,TS val 99025 ecr 99025], length 109
06:26:35.386634 IP vp1.57476 > 192.168.99.100.7051: Flags [.], ack 1694, win 254, options [nop,nop,TS val 99030 ecr 99025], length 0
06:26:40.234609 IP 192.168.99.100.7051 > vp1.57476: Flags [P.], seq 1694:1739, ack 1695, win 243, options [nop,nop,TS val 99514 ecr 99030], length 45
06:26:40.234619 IP vp1.57476 > 192.168.99.100.7051: Flags [.], ack 1739, win 254, options [nop,nop,TS val 99514 ecr 99514], length 0
06:26:40.234934 IP vp1.57476 > 192.168.99.100.7051: Flags [P.], seq 1695:1804, ack 1739, win 254, options [nop,nop,TS val 99514 ecr 99514], length 109
06:26:40.276074 IP 192.168.99.100.7051 > vp1.57476: Flags [.], ack 1804, win 243, options [nop,nop,TS val 99519 ecr 99514], length 0
06:26:40.343032 IP vp1.57476 > 192.168.99.100.7051: Flags [P.], seq 1804:1849, ack 1739, win 254, options [nop,nop,TS val 99525 ecr 99519], length 45
06:26:40.343057 IP 192.168.99.100.7051 > vp1.57476: Flags [.], ack 1849, win 243, options [nop,nop,TS val 99525 ecr 99525], length 0
06:26:40.343470 IP 192.168.99.100.7051 > vp1.57476: Flags [P.], seq 1739:1848, ack 1849, win 243, options [nop,nop,TS val 99525 ecr 99525], length 109
06:26:40.386319 IP vp1.57476 > 192.168.99.100.7051: Flags [.], ack 1848, win 254, options [nop,nop,TS val 99530 ecr 99525], length 0
06:26:45.234863 IP 192.168.99.100.7051 > vp1.57476: Flags [P.], seq 1848:1893, ack 1849, win 243, options [nop,nop,TS val 100014 ecr 99530], length 45
06:26:45.234875 IP vp1.57476 > 192.168.99.100.7051: Flags [.], ack 1893, win 254, options [nop,nop,TS val 100014 ecr 100014], length 0
06:26:45.235086 IP vp1.57476 > 192.168.99.100.7051: Flags [P.], seq 1849:1958, ack 1893, win 254, options [nop,nop,TS val 100014 ecr 100014], length 109
06:26:45.276536 IP 192.168.99.100.7051 > vp1.57476: Flags [.], ack 1958, win 243, options [nop,nop,TS val 100019 ecr 100014], length 0
06:26:45.343173 IP vp1.57476 > 192.168.99.100.7051: Flags [P.], seq 1958:2003, ack 1893, win 254, options [nop,nop,TS val 100025 ecr 100019], length 45
06:26:45.343196 IP 192.168.99.100.7051 > vp1.57476: Flags [.], ack 2003, win 243, options [nop,nop,TS val 100025 ecr 100025], length 0
06:26:45.343596 IP 192.168.99.100.7051 > vp1.57476: Flags [P.], seq 1893:2002, ack 2003, win 243, options [nop,nop,TS val 100025 ecr 100025], length 109
06:26:45.386491 IP vp1.57476 > 192.168.99.100.7051: Flags [.], ack 2002, win 254, options [nop,nop,TS val 100030 ecr 100025], length 0
06:26:50.234399 IP 192.168.99.100.7051 > vp1.57476: Flags [P.], seq 2002:2047, ack 2003, win 243, options [nop,nop,TS val 100514 ecr 100030], length 45
06:26:50.234410 IP vp1.57476 > 192.168.99.100.7051: Flags [.], ack 2047, win 254, options [nop,nop,TS val 100514 ecr 100514], length 0
06:26:50.234739 IP vp1.57476 > 192.168.99.100.7051: Flags [P.], seq 2003:2112, ack 2047, win 254, options [nop,nop,TS val 100514 ecr 100514], length 109
06:26:50.276601 IP 192.168.99.100.7051 > vp1.57476: Flags [.], ack 2112, win 243, options [nop,nop,TS val 100519 ecr 100514], length 0
06:26:50.342580 IP vp1.57476 > 192.168.99.100.7051: Flags [P.], seq 2112:2157, ack 2047, win 254, options [nop,nop,TS val 100525 ecr 100519], length 45
06:26:50.342609 IP 192.168.99.100.7051 > vp1.57476: Flags [.], ack 2157, win 243, options [nop,nop,TS val 100525 ecr 100525], length 0
06:26:50.343019 IP 192.168.99.100.7051 > vp1.57476: Flags [P.], seq 2047:2156, ack 2157, win 243, options [nop,nop,TS val 100525 ecr 100525], length 109
06:26:50.386049 IP vp1.57476 > 192.168.99.100.7051: Flags [.], ack 2156, win 254, options [nop,nop,TS val 100530 ecr 100525], length 0
06:26:55.235028 IP 192.168.99.100.7051 > vp1.57476: Flags [P.], seq 2156:2201, ack 2157, win 243, options [nop,nop,TS val 101014 ecr 100530], length 45
06:26:55.235039 IP vp1.57476 > 192.168.99.100.7051: Flags [.], ack 2201, win 254, options [nop,nop,TS val 101014 ecr 101014], length 0
06:26:55.235283 IP vp1.57476 > 192.168.99.100.7051: Flags [P.], seq 2157:2266, ack 2201, win 254, options [nop,nop,TS val 101014 ecr 101014], length 109
06:26:55.276219 IP 192.168.99.100.7051 > vp1.57476: Flags [.], ack 2266, win 243, options [nop,nop,TS val 101019 ecr 101014], length 0
06:26:55.343373 IP vp1.57476 > 192.168.99.100.7051: Flags [P.], seq 2266:2311, ack 2201, win 254, options [nop,nop,TS val 101025 ecr 101019], length 45
06:26:55.343402 IP 192.168.99.100.7051 > vp1.57476: Flags [.], ack 2311, win 243, options [nop,nop,TS val 101025 ecr 101025], length 0
06:26:55.343806 IP 192.168.99.100.7051 > vp1.57476: Flags [P.], seq 2201:2310, ack 2311, win 243, options [nop,nop,TS val 101025 ecr 101025], length 109
06:26:55.386636 IP vp1.57476 > 192.168.99.100.7051: Flags [.], ack 2310, win 254, options [nop,nop,TS val 101030 ecr 101025], length 0
06:27:00.234663 IP 192.168.99.100.7051 > vp1.57476: Flags [P.], seq 2310:2355, ack 2311, win 243, options [nop,nop,TS val 101514 ecr 101030], length 45
06:27:00.234674 IP vp1.57476 > 192.168.99.100.7051: Flags [.], ack 2355, win 254, options [nop,nop,TS val 101514 ecr 101514], length 0
06:27:00.234919 IP vp1.57476 > 192.168.99.100.7051: Flags [P.], seq 2311:2420, ack 2355, win 254, options [nop,nop,TS val 101514 ecr 101514], length 109
06:27:00.276067 IP 192.168.99.100.7051 > vp1.57476: Flags [.], ack 2420, win 243, options [nop,nop,TS val 101519 ecr 101514], length 0
06:27:00.342987 IP vp1.57476 > 192.168.99.100.7051: Flags [P.], seq 2420:2465, ack 2355, win 254, options [nop,nop,TS val 101525 ecr 101519], length 45
06:27:00.343015 IP 192.168.99.100.7051 > vp1.57476: Flags [.], ack 2465, win 243, options [nop,nop,TS val 101525 ecr 101525], length 0
06:27:00.343417 IP 192.168.99.100.7051 > vp1.57476: Flags [P.], seq 2355:2464, ack 2465, win 243, options [nop,nop,TS val 101525 ecr 101525], length 109
06:27:00.386794 IP vp1.57476 > 192.168.99.100.7051: Flags [.], ack 2464, win 254, options [nop,nop,TS val 101530 ecr 101525], length 0
06:27:05.234270 IP 192.168.99.100.7051 > vp1.57476: Flags [P.], seq 2464:2509, ack 2465, win 243, options [nop,nop,TS val 102014 ecr 101530], length 45
06:27:05.234281 IP vp1.57476 > 192.168.99.100.7051: Flags [.], ack 2509, win 254, options [nop,nop,TS val 102014 ecr 102014], length 0
06:27:05.234516 IP vp1.57476 > 192.168.99.100.7051: Flags [P.], seq 2465:2574, ack 2509, win 254, options [nop,nop,TS val 102014 ecr 102014], length 109
06:27:05.276497 IP 192.168.99.100.7051 > vp1.57476: Flags [.], ack 2574, win 243, options [nop,nop,TS val 102019 ecr 102014], length 0
06:27:05.342621 IP vp1.57476 > 192.168.99.100.7051: Flags [P.], seq 2574:2619, ack 2509, win 254, options [nop,nop,TS val 102025 ecr 102019], length 45
06:27:05.342652 IP 192.168.99.100.7051 > vp1.57476: Flags [.], ack 2619, win 243, options [nop,nop,TS val 102025 ecr 102025], length 0
06:27:05.343062 IP 192.168.99.100.7051 > vp1.57476: Flags [P.], seq 2509:2618, ack 2619, win 243, options [nop,nop,TS val 102025 ecr 102025], length 109
06:27:05.386378 IP vp1.57476 > 192.168.99.100.7051: Flags [.], ack 2618, win 254, options [nop,nop,TS val 102030 ecr 102025], length 0
06:27:10.234369 IP 192.168.99.100.7051 > vp1.57476: Flags [P.], seq 2618:2663, ack 2619, win 243, options [nop,nop,TS val 102514 ecr 102030], length 45
06:27:10.234380 IP vp1.57476 > 192.168.99.100.7051: Flags [.], ack 2663, win 254, options [nop,nop,TS val 102514 ecr 102514], length 0
06:27:10.234619 IP vp1.57476 > 192.168.99.100.7051: Flags [P.], seq 2619:2728, ack 2663, win 254, options [nop,nop,TS val 102514 ecr 102514], length 109
06:27:10.277122 IP 192.168.99.100.7051 > vp1.57476: Flags [.], ack 2728, win 243, options [nop,nop,TS val 102519 ecr 102514], length 0
06:27:10.343778 IP vp1.57476 > 192.168.99.100.7051: Flags [P.], seq 2728:2773, ack 2663, win 254, options [nop,nop,TS val 102525 ecr 102519], length 45
06:27:10.343808 IP 192.168.99.100.7051 > vp1.57476: Flags [.], ack 2773, win 243, options [nop,nop,TS val 102525 ecr 102525], length 0
06:27:10.344219 IP 192.168.99.100.7051 > vp1.57476: Flags [P.], seq 2663:2772, ack 2773, win 243, options [nop,nop,TS val 102525 ecr 102525], length 109
06:27:10.387039 IP vp1.57476 > 192.168.99.100.7051: Flags [.], ack 2772, win 254, options [nop,nop,TS val 102530 ecr 102525], length 0
06:27:15.234529 IP 192.168.99.100.7051 > vp1.57476: Flags [P.], seq 2772:2817, ack 2773, win 243, options [nop,nop,TS val 103014 ecr 102530], length 45
06:27:15.234539 IP vp1.57476 > 192.168.99.100.7051: Flags [.], ack 2817, win 254, options [nop,nop,TS val 103014 ecr 103014], length 0
06:27:15.234801 IP vp1.57476 > 192.168.99.100.7051: Flags [P.], seq 2773:2882, ack 2817, win 254, options [nop,nop,TS val 103014 ecr 103014], length 109
06:27:15.276755 IP 192.168.99.100.7051 > vp1.57476: Flags [.], ack 2882, win 243, options [nop,nop,TS val 103019 ecr 103014], length 0
06:27:15.343392 IP vp1.57476 > 192.168.99.100.7051: Flags [P.], seq 2882:2927, ack 2817, win 254, options [nop,nop,TS val 103025 ecr 103019], length 45
06:27:15.343420 IP 192.168.99.100.7051 > vp1.57476: Flags [.], ack 2927, win 243, options [nop,nop,TS val 103025 ecr 103025], length 0
06:27:15.343822 IP 192.168.99.100.7051 > vp1.57476: Flags [P.], seq 2817:2926, ack 2927, win 243, options [nop,nop,TS val 103025 ecr 103025], length 109
06:27:15.386176 IP vp1.57476 > 192.168.99.100.7051: Flags [.], ack 2926, win 254, options [nop,nop,TS val 103030 ecr 103025], length 0
06:27:20.234343 IP 192.168.99.100.7051 > vp1.57476: Flags [P.], seq 2926:2971, ack 2927, win 243, options [nop,nop,TS val 103514 ecr 103030], length 45
06:27:20.234353 IP vp1.57476 > 192.168.99.100.7051: Flags [.], ack 2971, win 254, options [nop,nop,TS val 103514 ecr 103514], length 0
06:27:20.234536 IP vp1.57476 > 192.168.99.100.7051: Flags [P.], seq 2927:3036, ack 2971, win 254, options [nop,nop,TS val 103514 ecr 103514], length 109
06:27:20.276078 IP 192.168.99.100.7051 > vp1.57476: Flags [.], ack 3036, win 243, options [nop,nop,TS val 103519 ecr 103514], length 0
06:27:20.343364 IP vp1.57476 > 192.168.99.100.7051: Flags [P.], seq 3036:3081, ack 2971, win 254, options [nop,nop,TS val 103525 ecr 103519], length 45
06:27:20.343392 IP 192.168.99.100.7051 > vp1.57476: Flags [.], ack 3081, win 243, options [nop,nop,TS val 103525 ecr 103525], length 0
06:27:20.343798 IP 192.168.99.100.7051 > vp1.57476: Flags [P.], seq 2971:3080, ack 3081, win 243, options [nop,nop,TS val 103525 ecr 103525], length 109
06:27:20.386797 IP vp1.57476 > 192.168.99.100.7051: Flags [.], ack 3080, win 254, options [nop,nop,TS val 103530 ecr 103525], length 0
06:27:25.234304 IP 192.168.99.100.7051 > vp1.57476: Flags [P.], seq 3080:3125, ack 3081, win 243, options [nop,nop,TS val 104014 ecr 103530], length 45
06:27:25.234315 IP vp1.57476 > 192.168.99.100.7051: Flags [.], ack 3125, win 254, options [nop,nop,TS val 104014 ecr 104014], length 0
06:27:25.234553 IP vp1.57476 > 192.168.99.100.7051: Flags [P.], seq 3081:3190, ack 3125, win 254, options [nop,nop,TS val 104014 ecr 104014], length 109
06:27:25.276533 IP 192.168.99.100.7051 > vp1.57476: Flags [.], ack 3190, win 243, options [nop,nop,TS val 104019 ecr 104014], length 0
06:27:25.343101 IP vp1.57476 > 192.168.99.100.7051: Flags [P.], seq 3190:3235, ack 3125, win 254, options [nop,nop,TS val 104025 ecr 104019], length 45
06:27:25.343131 IP 192.168.99.100.7051 > vp1.57476: Flags [.], ack 3235, win 243, options [nop,nop,TS val 104025 ecr 104025], length 0
06:27:25.343536 IP 192.168.99.100.7051 > vp1.57476: Flags [P.], seq 3125:3234, ack 3235, win 243, options [nop,nop,TS val 104025 ecr 104025], length 109
06:27:25.386425 IP vp1.57476 > 192.168.99.100.7051: Flags [.], ack 3234, win 254, options [nop,nop,TS val 104030 ecr 104025], length 0
06:27:30.234392 IP 192.168.99.100.7051 > vp1.57476: Flags [P.], seq 3234:3279, ack 3235, win 243, options [nop,nop,TS val 104514 ecr 104030], length 45
06:27:30.234402 IP vp1.57476 > 192.168.99.100.7051: Flags [.], ack 3279, win 254, options [nop,nop,TS val 104514 ecr 104514], length 0
06:27:30.234640 IP vp1.57476 > 192.168.99.100.7051: Flags [P.], seq 3235:3344, ack 3279, win 254, options [nop,nop,TS val 104514 ecr 104514], length 109
06:27:30.276632 IP 192.168.99.100.7051 > vp1.57476: Flags [.], ack 3344, win 243, options [nop,nop,TS val 104519 ecr 104514], length 0
06:27:30.342573 IP vp1.57476 > 192.168.99.100.7051: Flags [P.], seq 3344:3389, ack 3279, win 254, options [nop,nop,TS val 104525 ecr 104519], length 45
06:27:30.342601 IP 192.168.99.100.7051 > vp1.57476: Flags [.], ack 3389, win 243, options [nop,nop,TS val 104525 ecr 104525], length 0
06:27:30.343024 IP 192.168.99.100.7051 > vp1.57476: Flags [P.], seq 3279:3388, ack 3389, win 243, options [nop,nop,TS val 104525 ecr 104525], length 109
06:27:30.386521 IP vp1.57476 > 192.168.99.100.7051: Flags [.], ack 3388, win 254, options [nop,nop,TS val 104530 ecr 104525], length 0
06:27:35.234565 IP 192.168.99.100.7051 > vp1.57476: Flags [P.], seq 3388:3433, ack 3389, win 243, options [nop,nop,TS val 105014 ecr 104530], length 45
06:27:35.234575 IP vp1.57476 > 192.168.99.100.7051: Flags [.], ack 3433, win 254, options [nop,nop,TS val 105014 ecr 105014], length 0
06:27:35.234810 IP vp1.57476 > 192.168.99.100.7051: Flags [P.], seq 3389:3498, ack 3433, win 254, options [nop,nop,TS val 105014 ecr 105014], length 109
06:27:35.276762 IP 192.168.99.100.7051 > vp1.57476: Flags [.], ack 3498, win 243, options [nop,nop,TS val 105019 ecr 105014], length 0
06:27:35.342884 IP vp1.57476 > 192.168.99.100.7051: Flags [P.], seq 3498:3543, ack 3433, win 254, options [nop,nop,TS val 105025 ecr 105019], length 45
06:27:35.342913 IP 192.168.99.100.7051 > vp1.57476: Flags [.], ack 3543, win 243, options [nop,nop,TS val 105025 ecr 105025], length 0
06:27:35.343314 IP 192.168.99.100.7051 > vp1.57476: Flags [P.], seq 3433:3542, ack 3543, win 243, options [nop,nop,TS val 105025 ecr 105025], length 109
06:27:35.386045 IP vp1.57476 > 192.168.99.100.7051: Flags [.], ack 3542, win 254, options [nop,nop,TS val 105030 ecr 105025], length 0
06:27:40.234653 IP 192.168.99.100.7051 > vp1.57476: Flags [P.], seq 3542:3587, ack 3543, win 243, options [nop,nop,TS val 105514 ecr 105030], length 45
06:27:40.234664 IP vp1.57476 > 192.168.99.100.7051: Flags [.], ack 3587, win 254, options [nop,nop,TS val 105514 ecr 105514], length 0
06:27:40.234900 IP vp1.57476 > 192.168.99.100.7051: Flags [P.], seq 3543:3652, ack 3587, win 254, options [nop,nop,TS val 105514 ecr 105514], length 109
06:27:40.276402 IP 192.168.99.100.7051 > vp1.57476: Flags [.], ack 3652, win 243, options [nop,nop,TS val 105519 ecr 105514], length 0
06:27:40.342601 IP vp1.57476 > 192.168.99.100.7051: Flags [P.], seq 3652:3697, ack 3587, win 254, options [nop,nop,TS val 105525 ecr 105519], length 45
06:27:40.342630 IP 192.168.99.100.7051 > vp1.57476: Flags [.], ack 3697, win 243, options [nop,nop,TS val 105525 ecr 105525], length 0
06:27:40.343022 IP 192.168.99.100.7051 > vp1.57476: Flags [P.], seq 3587:3696, ack 3697, win 243, options [nop,nop,TS val 105525 ecr 105525], length 109
06:27:40.386293 IP vp1.57476 > 192.168.99.100.7051: Flags [.], ack 3696, win 254, options [nop,nop,TS val 105530 ecr 105525], length 0
06:27:45.234293 IP 192.168.99.100.7051 > vp1.57476: Flags [P.], seq 3696:3741, ack 3697, win 243, options [nop,nop,TS val 106014 ecr 105530], length 45
06:27:45.234303 IP vp1.57476 > 192.168.99.100.7051: Flags [.], ack 3741, win 254, options [nop,nop,TS val 106014 ecr 106014], length 0
06:27:45.234546 IP vp1.57476 > 192.168.99.100.7051: Flags [P.], seq 3697:3806, ack 3741, win 254, options [nop,nop,TS val 106014 ecr 106014], length 109
06:27:45.276506 IP 192.168.99.100.7051 > vp1.57476: Flags [.], ack 3806, win 243, options [nop,nop,TS val 106019 ecr 106014], length 0
06:27:45.343155 IP vp1.57476 > 192.168.99.100.7051: Flags [P.], seq 3806:3851, ack 3741, win 254, options [nop,nop,TS val 106025 ecr 106019], length 45
06:27:45.343181 IP 192.168.99.100.7051 > vp1.57476: Flags [.], ack 3851, win 243, options [nop,nop,TS val 106025 ecr 106025], length 0
06:27:45.343594 IP 192.168.99.100.7051 > vp1.57476: Flags [P.], seq 3741:3850, ack 3851, win 243, options [nop,nop,TS val 106025 ecr 106025], length 109
06:27:45.386395 IP vp1.57476 > 192.168.99.100.7051: Flags [.], ack 3850, win 254, options [nop,nop,TS val 106030 ecr 106025], length 0

