07:25:14.979539 IP 172.17.0.4.7061 > vp0.50612: Flags [P.], seq 1843633013:1843633058, ack 621258459, win 243, options [nop,nop,TS val 450989 ecr 450489], length 45
07:25:14.979550 IP vp0.50612 > 172.17.0.4.7061: Flags [.], ack 45, win 254, options [nop,nop,TS val 450989 ecr 450989], length 0
07:25:15.013596 IP vp0.7051 > 172.17.0.1.37478: Flags [P.], seq 716477711:716477756, ack 3788144721, win 243, options [nop,nop,TS val 450992 ecr 450492], length 45
07:25:15.013626 IP 172.17.0.1.37478 > vp0.7051: Flags [.], ack 45, win 254, options [nop,nop,TS val 450992 ecr 450992], length 0
07:25:15.246917 IP vp0.42287 > 10.0.2.3.domain: 5272+ PTR? 4.0.17.172.in-addr.arpa. (41)
07:25:15.257482 IP 10.0.2.3.domain > vp0.42287: 5272 NXDomain* 0/1/0 (118)
07:25:15.257627 IP vp0.51517 > 10.0.2.3.domain: 12107+ PTR? 1.0.17.172.in-addr.arpa. (41)
07:25:15.266438 IP 10.0.2.3.domain > vp0.51517: 12107 NXDomain* 0/1/0 (118)
07:25:15.503416 IP vp0.7051 > 172.17.0.1.37488: Flags [P.], seq 304604217:304604262, ack 2623157686, win 1432, options [nop,nop,TS val 451041 ecr 450561], length 45
07:25:15.503445 IP 172.17.0.1.37488 > vp0.7051: Flags [.], ack 45, win 1424, options [nop,nop,TS val 451041 ecr 451041], length 0
07:25:15.504667 IP 172.17.0.1.37488 > vp0.7051: Flags [P.], seq 1:172, ack 45, win 1424, options [nop,nop,TS val 451041 ecr 451041], length 171
07:25:15.546055 IP vp0.7051 > 172.17.0.1.37488: Flags [.], ack 172, win 1432, options [nop,nop,TS val 451046 ecr 451041], length 0
07:25:15.654826 IP 172.17.0.1.37488 > vp0.7051: Flags [P.], seq 172:217, ack 45, win 1424, options [nop,nop,TS val 451056 ecr 451046], length 45
07:25:15.654834 IP vp0.7051 > 172.17.0.1.37488: Flags [.], ack 217, win 1432, options [nop,nop,TS val 451056 ecr 451056], length 0
07:25:15.655998 IP vp0.7051 > 172.17.0.1.37488: Flags [P.], seq 45:216, ack 217, win 1432, options [nop,nop,TS val 451056 ecr 451056], length 171
07:25:15.696141 IP 172.17.0.1.37488 > vp0.7051: Flags [.], ack 216, win 1424, options [nop,nop,TS val 451061 ecr 451056], length 0
07:25:16.286177 IP vp0.38074 > 10.0.2.3.domain: 20070+ PTR? 3.2.0.10.in-addr.arpa. (39)
07:25:16.306460 IP 10.0.2.3.domain > vp0.38074: 20070 NXDomain* 0/1/0 (116)
07:25:19.978758 IP 172.17.0.4.7061 > vp0.50612: Flags [P.], seq 45:90, ack 1, win 243, options [nop,nop,TS val 451489 ecr 450989], length 45
07:25:19.978770 IP vp0.50612 > 172.17.0.4.7061: Flags [.], ack 90, win 254, options [nop,nop,TS val 451489 ecr 451489], length 0
07:25:20.014270 IP vp0.7051 > 172.17.0.1.37478: Flags [P.], seq 45:90, ack 1, win 243, options [nop,nop,TS val 451492 ecr 450992], length 45
07:25:20.014299 IP 172.17.0.1.37478 > vp0.7051: Flags [.], ack 90, win 254, options [nop,nop,TS val 451492 ecr 451492], length 0
07:25:20.502919 IP vp0.7051 > 172.17.0.1.37488: Flags [P.], seq 216:261, ack 217, win 1432, options [nop,nop,TS val 451541 ecr 451061], length 45
07:25:20.502943 IP 172.17.0.1.37488 > vp0.7051: Flags [.], ack 261, win 1424, options [nop,nop,TS val 451541 ecr 451541], length 0
07:25:20.503362 IP 172.17.0.1.37488 > vp0.7051: Flags [P.], seq 217:388, ack 261, win 1424, options [nop,nop,TS val 451541 ecr 451541], length 171
07:25:20.546642 IP vp0.7051 > 172.17.0.1.37488: Flags [.], ack 388, win 1432, options [nop,nop,TS val 451546 ecr 451541], length 0
07:25:20.654564 IP 172.17.0.1.37488 > vp0.7051: Flags [P.], seq 388:433, ack 261, win 1424, options [nop,nop,TS val 451556 ecr 451546], length 45
07:25:20.654572 IP vp0.7051 > 172.17.0.1.37488: Flags [.], ack 433, win 1432, options [nop,nop,TS val 451556 ecr 451556], length 0
07:25:20.654833 IP vp0.7051 > 172.17.0.1.37488: Flags [P.], seq 261:432, ack 433, win 1432, options [nop,nop,TS val 451556 ecr 451556], length 171
07:25:20.696252 IP 172.17.0.1.37488 > vp0.7051: Flags [.], ack 432, win 1424, options [nop,nop,TS val 451561 ecr 451556], length 0
07:25:24.978784 IP 172.17.0.4.7061 > vp0.50612: Flags [P.], seq 90:135, ack 1, win 243, options [nop,nop,TS val 451989 ecr 451489], length 45
07:25:24.978796 IP vp0.50612 > 172.17.0.4.7061: Flags [.], ack 135, win 254, options [nop,nop,TS val 451989 ecr 451989], length 0
07:25:25.013780 IP vp0.7051 > 172.17.0.1.37478: Flags [P.], seq 90:135, ack 1, win 243, options [nop,nop,TS val 451992 ecr 451492], length 45
07:25:25.013810 IP 172.17.0.1.37478 > vp0.7051: Flags [.], ack 135, win 254, options [nop,nop,TS val 451992 ecr 451992], length 0
07:25:25.503910 IP vp0.7051 > 172.17.0.1.37488: Flags [P.], seq 432:477, ack 433, win 1432, options [nop,nop,TS val 452041 ecr 451561], length 45
07:25:25.503938 IP 172.17.0.1.37488 > vp0.7051: Flags [.], ack 477, win 1424, options [nop,nop,TS val 452041 ecr 452041], length 0
07:25:25.504353 IP 172.17.0.1.37488 > vp0.7051: Flags [P.], seq 433:604, ack 477, win 1424, options [nop,nop,TS val 452041 ecr 452041], length 171
07:25:25.546308 IP vp0.7051 > 172.17.0.1.37488: Flags [.], ack 604, win 1432, options [nop,nop,TS val 452046 ecr 452041], length 0
07:25:25.655027 IP 172.17.0.1.37488 > vp0.7051: Flags [P.], seq 604:649, ack 477, win 1424, options [nop,nop,TS val 452056 ecr 452046], length 45
07:25:25.655035 IP vp0.7051 > 172.17.0.1.37488: Flags [.], ack 649, win 1432, options [nop,nop,TS val 452056 ecr 452056], length 0
07:25:25.655261 IP vp0.7051 > 172.17.0.1.37488: Flags [P.], seq 477:648, ack 649, win 1432, options [nop,nop,TS val 452056 ecr 452056], length 171
07:25:25.696363 IP 172.17.0.1.37488 > vp0.7051: Flags [.], ack 648, win 1424, options [nop,nop,TS val 452061 ecr 452056], length 0
07:25:29.978902 IP 172.17.0.4.7061 > vp0.50612: Flags [P.], seq 135:180, ack 1, win 243, options [nop,nop,TS val 452489 ecr 451989], length 45
07:25:29.978914 IP vp0.50612 > 172.17.0.4.7061: Flags [.], ack 180, win 254, options [nop,nop,TS val 452489 ecr 452489], length 0
07:25:30.013591 IP vp0.7051 > 172.17.0.1.37478: Flags [P.], seq 135:180, ack 1, win 243, options [nop,nop,TS val 452492 ecr 451992], length 45
07:25:30.013620 IP 172.17.0.1.37478 > vp0.7051: Flags [.], ack 180, win 254, options [nop,nop,TS val 452492 ecr 452492], length 0
07:25:30.502918 IP vp0.7051 > 172.17.0.1.37488: Flags [P.], seq 648:693, ack 649, win 1432, options [nop,nop,TS val 452541 ecr 452061], length 45
07:25:30.502950 IP 172.17.0.1.37488 > vp0.7051: Flags [.], ack 693, win 1424, options [nop,nop,TS val 452541 ecr 452541], length 0
07:25:30.503400 IP 172.17.0.1.37488 > vp0.7051: Flags [P.], seq 649:820, ack 693, win 1424, options [nop,nop,TS val 452541 ecr 452541], length 171
07:25:30.546461 IP vp0.7051 > 172.17.0.1.37488: Flags [.], ack 820, win 1432, options [nop,nop,TS val 452546 ecr 452541], length 0
07:25:30.654675 IP 172.17.0.1.37488 > vp0.7051: Flags [P.], seq 820:865, ack 693, win 1424, options [nop,nop,TS val 452556 ecr 452546], length 45
07:25:30.654682 IP vp0.7051 > 172.17.0.1.37488: Flags [.], ack 865, win 1432, options [nop,nop,TS val 452556 ecr 452556], length 0
07:25:30.654906 IP vp0.7051 > 172.17.0.1.37488: Flags [P.], seq 693:864, ack 865, win 1432, options [nop,nop,TS val 452556 ecr 452556], length 171
07:25:30.696442 IP 172.17.0.1.37488 > vp0.7051: Flags [.], ack 864, win 1424, options [nop,nop,TS val 452561 ecr 452556], length 0
07:25:34.979621 IP 172.17.0.4.7061 > vp0.50612: Flags [P.], seq 180:225, ack 1, win 243, options [nop,nop,TS val 452989 ecr 452489], length 45
07:25:34.979634 IP vp0.50612 > 172.17.0.4.7061: Flags [.], ack 225, win 254, options [nop,nop,TS val 452989 ecr 452989], length 0
07:25:35.014114 IP vp0.7051 > 172.17.0.1.37478: Flags [P.], seq 180:225, ack 1, win 243, options [nop,nop,TS val 452992 ecr 452492], length 45
07:25:35.014146 IP 172.17.0.1.37478 > vp0.7051: Flags [.], ack 225, win 254, options [nop,nop,TS val 452992 ecr 452992], length 0
07:25:35.503056 IP vp0.7051 > 172.17.0.1.37488: Flags [P.], seq 864:909, ack 865, win 1432, options [nop,nop,TS val 453041 ecr 452561], length 45
07:25:35.503088 IP 172.17.0.1.37488 > vp0.7051: Flags [.], ack 909, win 1424, options [nop,nop,TS val 453041 ecr 453041], length 0
07:25:35.503515 IP 172.17.0.1.37488 > vp0.7051: Flags [P.], seq 865:1036, ack 909, win 1424, options [nop,nop,TS val 453041 ecr 453041], length 171
07:25:35.546468 IP vp0.7051 > 172.17.0.1.37488: Flags [.], ack 1036, win 1432, options [nop,nop,TS val 453046 ecr 453041], length 0
07:25:35.654844 IP 172.17.0.1.37488 > vp0.7051: Flags [P.], seq 1036:1081, ack 909, win 1424, options [nop,nop,TS val 453056 ecr 453046], length 45
07:25:35.654852 IP vp0.7051 > 172.17.0.1.37488: Flags [.], ack 1081, win 1432, options [nop,nop,TS val 453056 ecr 453056], length 0
07:25:35.655100 IP vp0.7051 > 172.17.0.1.37488: Flags [P.], seq 909:1080, ack 1081, win 1432, options [nop,nop,TS val 453056 ecr 453056], length 171
07:25:35.696609 IP 172.17.0.1.37488 > vp0.7051: Flags [.], ack 1080, win 1424, options [nop,nop,TS val 453061 ecr 453056], length 0
07:25:39.978733 IP 172.17.0.4.7061 > vp0.50612: Flags [P.], seq 225:270, ack 1, win 243, options [nop,nop,TS val 453489 ecr 452989], length 45
07:25:39.978745 IP vp0.50612 > 172.17.0.4.7061: Flags [.], ack 270, win 254, options [nop,nop,TS val 453489 ecr 453489], length 0
07:25:40.013695 IP vp0.7051 > 172.17.0.1.37478: Flags [P.], seq 225:270, ack 1, win 243, options [nop,nop,TS val 453492 ecr 452992], length 45
07:25:40.013723 IP 172.17.0.1.37478 > vp0.7051: Flags [.], ack 270, win 254, options [nop,nop,TS val 453492 ecr 453492], length 0
07:25:40.503293 IP vp0.7051 > 172.17.0.1.37488: Flags [P.], seq 1080:1125, ack 1081, win 1432, options [nop,nop,TS val 453541 ecr 453061], length 45
07:25:40.503325 IP 172.17.0.1.37488 > vp0.7051: Flags [.], ack 1125, win 1424, options [nop,nop,TS val 453541 ecr 453541], length 0
07:25:40.503759 IP 172.17.0.1.37488 > vp0.7051: Flags [P.], seq 1081:1252, ack 1125, win 1424, options [nop,nop,TS val 453541 ecr 453541], length 171
07:25:40.546145 IP vp0.7051 > 172.17.0.1.37488: Flags [.], ack 1252, win 1432, options [nop,nop,TS val 453546 ecr 453541], length 0
07:25:40.654561 IP 172.17.0.1.37488 > vp0.7051: Flags [P.], seq 1252:1297, ack 1125, win 1424, options [nop,nop,TS val 453556 ecr 453546], length 45
07:25:40.654569 IP vp0.7051 > 172.17.0.1.37488: Flags [.], ack 1297, win 1432, options [nop,nop,TS val 453556 ecr 453556], length 0
07:25:40.654755 IP vp0.7051 > 172.17.0.1.37488: Flags [P.], seq 1125:1296, ack 1297, win 1432, options [nop,nop,TS val 453556 ecr 453556], length 171
07:25:40.696078 IP 172.17.0.1.37488 > vp0.7051: Flags [.], ack 1296, win 1424, options [nop,nop,TS val 453561 ecr 453556], length 0
07:25:44.978821 IP 172.17.0.4.7061 > vp0.50612: Flags [P.], seq 270:315, ack 1, win 243, options [nop,nop,TS val 453989 ecr 453489], length 45
07:25:44.978833 IP vp0.50612 > 172.17.0.4.7061: Flags [.], ack 315, win 254, options [nop,nop,TS val 453989 ecr 453989], length 0
07:25:45.013649 IP vp0.7051 > 172.17.0.1.37478: Flags [P.], seq 270:315, ack 1, win 243, options [nop,nop,TS val 453992 ecr 453492], length 45
07:25:45.013678 IP 172.17.0.1.37478 > vp0.7051: Flags [.], ack 315, win 254, options [nop,nop,TS val 453992 ecr 453992], length 0
07:25:45.503393 IP vp0.7051 > 172.17.0.1.37488: Flags [P.], seq 1296:1341, ack 1297, win 1432, options [nop,nop,TS val 454041 ecr 453561], length 45
07:25:45.503425 IP 172.17.0.1.37488 > vp0.7051: Flags [.], ack 1341, win 1424, options [nop,nop,TS val 454041 ecr 454041], length 0
07:25:45.503853 IP 172.17.0.1.37488 > vp0.7051: Flags [P.], seq 1297:1468, ack 1341, win 1424, options [nop,nop,TS val 454041 ecr 454041], length 171
07:25:45.546225 IP vp0.7051 > 172.17.0.1.37488: Flags [.], ack 1468, win 1432, options [nop,nop,TS val 454046 ecr 454041], length 0
07:25:45.655558 IP 172.17.0.1.37488 > vp0.7051: Flags [P.], seq 1468:1513, ack 1341, win 1424, options [nop,nop,TS val 454056 ecr 454046], length 45
07:25:45.655566 IP vp0.7051 > 172.17.0.1.37488: Flags [.], ack 1513, win 1432, options [nop,nop,TS val 454056 ecr 454056], length 0
07:25:45.655814 IP vp0.7051 > 172.17.0.1.37488: Flags [P.], seq 1341:1512, ack 1513, win 1432, options [nop,nop,TS val 454056 ecr 454056], length 171
07:25:45.696346 IP 172.17.0.1.37488 > vp0.7051: Flags [.], ack 1512, win 1424, options [nop,nop,TS val 454061 ecr 454056], length 0
07:25:49.979472 IP 172.17.0.4.7061 > vp0.50612: Flags [P.], seq 315:360, ack 1, win 243, options [nop,nop,TS val 454489 ecr 453989], length 45
07:25:49.979485 IP vp0.50612 > 172.17.0.4.7061: Flags [.], ack 360, win 254, options [nop,nop,TS val 454489 ecr 454489], length 0
07:25:50.013636 IP vp0.7051 > 172.17.0.1.37478: Flags [P.], seq 315:360, ack 1, win 243, options [nop,nop,TS val 454492 ecr 453992], length 45
07:25:50.013700 IP 172.17.0.1.37478 > vp0.7051: Flags [.], ack 360, win 254, options [nop,nop,TS val 454492 ecr 454492], length 0
07:25:50.506045 IP vp0.7051 > 172.17.0.1.37488: Flags [P.], seq 1512:1557, ack 1513, win 1432, options [nop,nop,TS val 454541 ecr 454061], length 45
07:25:50.506076 IP 172.17.0.1.37488 > vp0.7051: Flags [.], ack 1557, win 1424, options [nop,nop,TS val 454541 ecr 454541], length 0
07:25:50.506527 IP 172.17.0.1.37488 > vp0.7051: Flags [P.], seq 1513:1684, ack 1557, win 1424, options [nop,nop,TS val 454542 ecr 454541], length 171
07:25:50.556040 IP vp0.7051 > 172.17.0.1.37488: Flags [.], ack 1684, win 1432, options [nop,nop,TS val 454547 ecr 454542], length 0
07:25:50.655193 IP 172.17.0.1.37488 > vp0.7051: Flags [P.], seq 1684:1729, ack 1557, win 1424, options [nop,nop,TS val 454556 ecr 454547], length 45
07:25:50.655200 IP vp0.7051 > 172.17.0.1.37488: Flags [.], ack 1729, win 1432, options [nop,nop,TS val 454556 ecr 454556], length 0
07:25:50.655438 IP vp0.7051 > 172.17.0.1.37488: Flags [P.], seq 1557:1728, ack 1729, win 1432, options [nop,nop,TS val 454556 ecr 454556], length 171
07:25:50.696324 IP 172.17.0.1.37488 > vp0.7051: Flags [.], ack 1728, win 1424, options [nop,nop,TS val 454561 ecr 454556], length 0
07:25:54.979092 IP 172.17.0.4.7061 > vp0.50612: Flags [P.], seq 360:405, ack 1, win 243, options [nop,nop,TS val 454989 ecr 454489], length 45
07:25:54.979106 IP vp0.50612 > 172.17.0.4.7061: Flags [.], ack 405, win 254, options [nop,nop,TS val 454989 ecr 454989], length 0
07:25:55.013750 IP vp0.7051 > 172.17.0.1.37478: Flags [P.], seq 360:405, ack 1, win 243, options [nop,nop,TS val 454992 ecr 454492], length 45
07:25:55.013779 IP 172.17.0.1.37478 > vp0.7051: Flags [.], ack 405, win 254, options [nop,nop,TS val 454992 ecr 454992], length 0
07:25:55.503972 IP vp0.7051 > 172.17.0.1.37488: Flags [P.], seq 1728:1773, ack 1729, win 1432, options [nop,nop,TS val 455041 ecr 454561], length 45
07:25:55.504000 IP 172.17.0.1.37488 > vp0.7051: Flags [.], ack 1773, win 1424, options [nop,nop,TS val 455041 ecr 455041], length 0
07:25:55.505150 IP 172.17.0.1.37488 > vp0.7051: Flags [P.], seq 1729:1900, ack 1773, win 1424, options [nop,nop,TS val 455041 ecr 455041], length 171
07:25:55.546478 IP vp0.7051 > 172.17.0.1.37488: Flags [.], ack 1900, win 1432, options [nop,nop,TS val 455046 ecr 455041], length 0
07:25:55.655031 IP 172.17.0.1.37488 > vp0.7051: Flags [P.], seq 1900:1945, ack 1773, win 1424, options [nop,nop,TS val 455056 ecr 455046], length 45
07:25:55.655039 IP vp0.7051 > 172.17.0.1.37488: Flags [.], ack 1945, win 1432, options [nop,nop,TS val 455056 ecr 455056], length 0
07:25:55.656346 IP vp0.7051 > 172.17.0.1.37488: Flags [P.], seq 1773:1944, ack 1945, win 1432, options [nop,nop,TS val 455057 ecr 455056], length 171
07:25:55.706522 IP 172.17.0.1.37488 > vp0.7051: Flags [.], ack 1944, win 1424, options [nop,nop,TS val 455062 ecr 455057], length 0
07:25:59.979214 IP 172.17.0.4.7061 > vp0.50612: Flags [P.], seq 405:450, ack 1, win 243, options [nop,nop,TS val 455489 ecr 454989], length 45
07:25:59.979227 IP vp0.50612 > 172.17.0.4.7061: Flags [.], ack 450, win 254, options [nop,nop,TS val 455489 ecr 455489], length 0
07:26:00.014179 IP vp0.7051 > 172.17.0.1.37478: Flags [P.], seq 405:450, ack 1, win 243, options [nop,nop,TS val 455492 ecr 454992], length 45
07:26:00.014211 IP 172.17.0.1.37478 > vp0.7051: Flags [.], ack 450, win 254, options [nop,nop,TS val 455492 ecr 455492], length 0
07:26:00.502903 IP vp0.7051 > 172.17.0.1.37488: Flags [P.], seq 1944:1989, ack 1945, win 1432, options [nop,nop,TS val 455541 ecr 455062], length 45
07:26:00.503065 IP 172.17.0.1.37488 > vp0.7051: Flags [.], ack 1989, win 1424, options [nop,nop,TS val 455541 ecr 455541], length 0
07:26:00.503462 IP 172.17.0.1.37488 > vp0.7051: Flags [P.], seq 1945:2116, ack 1989, win 1424, options [nop,nop,TS val 455541 ecr 455541], length 171
07:26:00.546582 IP vp0.7051 > 172.17.0.1.37488: Flags [.], ack 2116, win 1432, options [nop,nop,TS val 455546 ecr 455541], length 0
07:26:00.654966 IP 172.17.0.1.37488 > vp0.7051: Flags [P.], seq 2116:2161, ack 1989, win 1424, options [nop,nop,TS val 455556 ecr 455546], length 45
07:26:00.654974 IP vp0.7051 > 172.17.0.1.37488: Flags [.], ack 2161, win 1432, options [nop,nop,TS val 455556 ecr 455556], length 0
07:26:00.655219 IP vp0.7051 > 172.17.0.1.37488: Flags [P.], seq 1989:2160, ack 2161, win 1432, options [nop,nop,TS val 455556 ecr 455556], length 171
07:26:00.696193 IP 172.17.0.1.37488 > vp0.7051: Flags [.], ack 2160, win 1424, options [nop,nop,TS val 455561 ecr 455556], length 0
07:26:04.979362 IP 172.17.0.4.7061 > vp0.50612: Flags [P.], seq 450:495, ack 1, win 243, options [nop,nop,TS val 455989 ecr 455489], length 45
07:26:04.979374 IP vp0.50612 > 172.17.0.4.7061: Flags [.], ack 495, win 254, options [nop,nop,TS val 455989 ecr 455989], length 0
07:26:05.013845 IP vp0.7051 > 172.17.0.1.37478: Flags [P.], seq 450:495, ack 1, win 243, options [nop,nop,TS val 455992 ecr 455492], length 45
07:26:05.013877 IP 172.17.0.1.37478 > vp0.7051: Flags [.], ack 495, win 254, options [nop,nop,TS val 455992 ecr 455992], length 0
07:26:05.503425 IP vp0.7051 > 172.17.0.1.37488: Flags [P.], seq 2160:2205, ack 2161, win 1432, options [nop,nop,TS val 456041 ecr 455561], length 45
07:26:05.503455 IP 172.17.0.1.37488 > vp0.7051: Flags [.], ack 2205, win 1424, options [nop,nop,TS val 456041 ecr 456041], length 0
07:26:05.503871 IP 172.17.0.1.37488 > vp0.7051: Flags [P.], seq 2161:2332, ack 2205, win 1424, options [nop,nop,TS val 456041 ecr 456041], length 171
07:26:05.546038 IP vp0.7051 > 172.17.0.1.37488: Flags [.], ack 2332, win 1432, options [nop,nop,TS val 456046 ecr 456041], length 0
07:26:05.655076 IP 172.17.0.1.37488 > vp0.7051: Flags [P.], seq 2332:2377, ack 2205, win 1424, options [nop,nop,TS val 456056 ecr 456046], length 45
07:26:05.655083 IP vp0.7051 > 172.17.0.1.37488: Flags [.], ack 2377, win 1432, options [nop,nop,TS val 456056 ecr 456056], length 0
07:26:05.655306 IP vp0.7051 > 172.17.0.1.37488: Flags [P.], seq 2205:2376, ack 2377, win 1432, options [nop,nop,TS val 456056 ecr 456056], length 171
07:26:05.696342 IP 172.17.0.1.37488 > vp0.7051: Flags [.], ack 2376, win 1424, options [nop,nop,TS val 456061 ecr 456056], length 0
07:26:09.978602 IP 172.17.0.4.7061 > vp0.50612: Flags [P.], seq 495:540, ack 1, win 243, options [nop,nop,TS val 456489 ecr 455989], length 45
07:26:09.978614 IP vp0.50612 > 172.17.0.4.7061: Flags [.], ack 540, win 254, options [nop,nop,TS val 456489 ecr 456489], length 0
07:26:10.013617 IP vp0.7051 > 172.17.0.1.37478: Flags [P.], seq 495:540, ack 1, win 243, options [nop,nop,TS val 456492 ecr 455992], length 45
07:26:10.013647 IP 172.17.0.1.37478 > vp0.7051: Flags [.], ack 540, win 254, options [nop,nop,TS val 456492 ecr 456492], length 0
07:26:10.503048 IP vp0.7051 > 172.17.0.1.37488: Flags [P.], seq 2376:2421, ack 2377, win 1432, options [nop,nop,TS val 456541 ecr 456061], length 45
07:26:10.503082 IP 172.17.0.1.37488 > vp0.7051: Flags [.], ack 2421, win 1424, options [nop,nop,TS val 456541 ecr 456541], length 0
07:26:10.503512 IP 172.17.0.1.37488 > vp0.7051: Flags [P.], seq 2377:2548, ack 2421, win 1424, options [nop,nop,TS val 456541 ecr 456541], length 171
07:26:10.546033 IP vp0.7051 > 172.17.0.1.37488: Flags [.], ack 2548, win 1432, options [nop,nop,TS val 456546 ecr 456541], length 0
07:26:10.654725 IP 172.17.0.1.37488 > vp0.7051: Flags [P.], seq 2548:2593, ack 2421, win 1424, options [nop,nop,TS val 456556 ecr 456546], length 45
07:26:10.654733 IP vp0.7051 > 172.17.0.1.37488: Flags [.], ack 2593, win 1432, options [nop,nop,TS val 456556 ecr 456556], length 0
07:26:10.654979 IP vp0.7051 > 172.17.0.1.37488: Flags [P.], seq 2421:2592, ack 2593, win 1432, options [nop,nop,TS val 456556 ecr 456556], length 171
07:26:10.696423 IP 172.17.0.1.37488 > vp0.7051: Flags [.], ack 2592, win 1424, options [nop,nop,TS val 456561 ecr 456556], length 0
07:26:14.979136 IP 172.17.0.4.7061 > vp0.50612: Flags [P.], seq 540:585, ack 1, win 243, options [nop,nop,TS val 456989 ecr 456489], length 45
07:26:14.979149 IP vp0.50612 > 172.17.0.4.7061: Flags [.], ack 585, win 254, options [nop,nop,TS val 456989 ecr 456989], length 0
07:26:15.013600 IP vp0.7051 > 172.17.0.1.37478: Flags [P.], seq 540:585, ack 1, win 243, options [nop,nop,TS val 456992 ecr 456492], length 45
07:26:15.013630 IP 172.17.0.1.37478 > vp0.7051: Flags [.], ack 585, win 254, options [nop,nop,TS val 456992 ecr 456992], length 0
07:26:15.503166 IP vp0.7051 > 172.17.0.1.37488: Flags [P.], seq 2592:2637, ack 2593, win 1432, options [nop,nop,TS val 457041 ecr 456561], length 45
07:26:15.503197 IP 172.17.0.1.37488 > vp0.7051: Flags [.], ack 2637, win 1424, options [nop,nop,TS val 457041 ecr 457041], length 0
07:26:15.503620 IP 172.17.0.1.37488 > vp0.7051: Flags [P.], seq 2593:2764, ack 2637, win 1424, options [nop,nop,TS val 457041 ecr 457041], length 171
07:26:15.546536 IP vp0.7051 > 172.17.0.1.37488: Flags [.], ack 2764, win 1432, options [nop,nop,TS val 457046 ecr 457041], length 0
07:26:15.654849 IP 172.17.0.1.37488 > vp0.7051: Flags [P.], seq 2764:2809, ack 2637, win 1424, options [nop,nop,TS val 457056 ecr 457046], length 45
07:26:15.654857 IP vp0.7051 > 172.17.0.1.37488: Flags [.], ack 2809, win 1432, options [nop,nop,TS val 457056 ecr 457056], length 0
07:26:15.655094 IP vp0.7051 > 172.17.0.1.37488: Flags [P.], seq 2637:2808, ack 2809, win 1432, options [nop,nop,TS val 457056 ecr 457056], length 171
07:26:15.696621 IP 172.17.0.1.37488 > vp0.7051: Flags [.], ack 2808, win 1424, options [nop,nop,TS val 457061 ecr 457056], length 0

